Nama,Khasiat,Produsen,Kategori,Khasiat_Length,Case_folding,punctuation_removal,tokenizing,stopwordremoval,stemming
jamu sariwangi ramuan madura,"untuk membantu menghilangkan bau mulut dan bau badan pada pria dan wanita, produk sari wangi ini merupakan jamu herbal yang bisa membantu menghilangkan bau mulut, bau badan dan keringat serta bau yang keluar dari tubuh manusia, dan juga bau yang keluar dari mulut yang bersumber dari perut dan pencernaan.",jokotole,Jamu Kesehatan,305,"untuk membantu menghilangkan bau mulut dan bau badan pada pria dan wanita, produk sari wangi ini merupakan jamu herbal yang bisa membantu menghilangkan bau mulut, bau badan dan keringat serta bau yang keluar dari tubuh manusia, dan juga bau yang keluar dari mulut yang bersumber dari perut dan pencernaan.",untuk membantu menghilangkan bau mulut dan bau badan pada pria dan wanita produk sari wangi ini merupakan jamu herbal yang bisa membantu menghilangkan bau mulut bau badan dan keringat serta bau yang keluar dari tubuh manusia dan juga bau yang keluar dari mulut yang bersumber dari perut dan pencernaan,"['untuk', 'membantu', 'menghilangkan', 'bau', 'mulut', 'dan', 'bau', 'badan', 'pada', 'pria', 'dan', 'wanita', 'produk', 'sari', 'wangi', 'ini', 'merupakan', 'jamu', 'herbal', 'yang', 'bisa', 'membantu', 'menghilangkan', 'bau', 'mulut', 'bau', 'badan', 'dan', 'keringat', 'serta', 'bau', 'yang', 'keluar', 'dari', 'tubuh', 'manusia', 'dan', 'juga', 'bau', 'yang', 'keluar', 'dari', 'mulut', 'yang', 'bersumber', 'dari', 'perut', 'dan', 'pencernaan']","['membantu', 'menghilangkan', 'bau', 'mulut', 'bau', 'badan', 'pria', 'wanita', 'produk', 'sari', 'wangi', 'jamu', 'herbal', 'membantu', 'menghilangkan', 'bau', 'mulut', 'bau', 'badan', 'keringat', 'bau', 'tubuh', 'manusia', 'bau', 'mulut', 'bersumber', 'perut', 'pencernaan']","['bantu', 'hilang', 'bau', 'mulut', 'bau', 'badan', 'pria', 'wanita', 'produk', 'sari', 'wangi', 'jamu', 'herbal', 'bantu', 'hilang', 'bau', 'mulut', 'bau', 'badan', 'keringat', 'bau', 'tubuh', 'manusia', 'bau', 'mulut', 'sumber', 'perut', 'cerna']"
Serimpang,"untuk kesehatan tubuh, membuat badan menjadi fresh kembali",UD. SIMPANG TIGA,Jamu Kesehatan,58,"untuk kesehatan tubuh, membuat badan menjadi fresh kembali",untuk kesehatan tubuh membuat badan menjadi fresh kembali,"['untuk', 'kesehatan', 'tubuh', 'membuat', 'badan', 'menjadi', 'fresh', 'kembali']","['kesehatan', 'tubuh', 'badan', 'fresh']","['sehat', 'tubuh', 'badan', 'fresh']"
Lancar darah,"untuk melancarkan keluarnya darah pada waktu dan masa datang bulan, mencegah dan mengurangi sakit perut, sakit pinggang, pusing, dan nyeri yang timbul pada masa datang bulan",Madura Sari,Jamu Perawatan Kewanitaan,173,"untuk melancarkan keluarnya darah pada waktu dan masa datang bulan, mencegah dan mengurangi sakit perut, sakit pinggang, pusing, dan nyeri yang timbul pada masa datang bulan",untuk melancarkan keluarnya darah pada waktu dan masa datang bulan mencegah dan mengurangi sakit perut sakit pinggang pusing dan nyeri yang timbul pada masa datang bulan,"['untuk', 'melancarkan', 'keluarnya', 'darah', 'pada', 'waktu', 'dan', 'masa', 'datang', 'bulan', 'mencegah', 'dan', 'mengurangi', 'sakit', 'perut', 'sakit', 'pinggang', 'pusing', 'dan', 'nyeri', 'yang', 'timbul', 'pada', 'masa', 'datang', 'bulan']","['melancarkan', 'keluarnya', 'darah', 'mencegah', 'mengurangi', 'sakit', 'perut', 'sakit', 'pinggang', 'pusing', 'nyeri', 'timbul']","['lancar', 'keluar', 'darah', 'cegah', 'kurang', 'sakit', 'perut', 'sakit', 'pinggang', 'pusing', 'nyeri', 'timbul']"
jamu tradisional madura kecantikan,"menjaga agar badan tetap sehat, segar, awet muda dan mencegah timbulnya jerawat, melangsingkan tubuh dan mengencangkan tubuh, mengurangi bau badan",Ny. Hj Hayati,Jamu Perawatan Kewanitaan,146,"menjaga agar badan tetap sehat, segar, awet muda dan mencegah timbulnya jerawat, melangsingkan tubuh dan mengencangkan tubuh, mengurangi bau badan",menjaga agar badan tetap sehat segar awet muda dan mencegah timbulnya jerawat melangsingkan tubuh dan mengencangkan tubuh mengurangi bau badan,"['menjaga', 'agar', 'badan', 'tetap', 'sehat', 'segar', 'awet', 'muda', 'dan', 'mencegah', 'timbulnya', 'jerawat', 'melangsingkan', 'tubuh', 'dan', 'mengencangkan', 'tubuh', 'mengurangi', 'bau', 'badan']","['menjaga', 'badan', 'sehat', 'segar', 'awet', 'muda', 'mencegah', 'timbulnya', 'jerawat', 'melangsingkan', 'tubuh', 'mengencangkan', 'tubuh', 'mengurangi', 'bau', 'badan']","['jaga', 'badan', 'sehat', 'segar', 'awet', 'muda', 'cegah', 'timbul', 'jerawat', 'langsing', 'tubuh', 'encang', 'tubuh', 'kurang', 'bau', 'badan']"
jamu gendong klasik madura(JKM),"Menjaga kebersihan Miss V, Mencegah keputihan, Menghilangkan bau tak sedap, Menghilangkan gatal - gatal, Mengurangi lendir berlebih, Merapatkan miss V, Empot - Empot, Membuat Miss V lebih keset dan harum, Mengencangkan otot - otot Miss V, Cocok untuk ibu menyusui, Melancarkan HAID, Mendetox kotoran yang ada pada rahim",JKM,Jamu Perawatan Kewanitaan,319,"menjaga kebersihan miss v, mencegah keputihan, menghilangkan bau tak sedap, menghilangkan gatal - gatal, mengurangi lendir berlebih, merapatkan miss v, empot - empot, membuat miss v lebih keset dan harum, mengencangkan otot - otot miss v, cocok untuk ibu menyusui, melancarkan haid, mendetox kotoran yang ada pada rahim",menjaga kebersihan miss v mencegah keputihan menghilangkan bau tak sedap menghilangkan gatal  gatal mengurangi lendir berlebih merapatkan miss v empot  empot membuat miss v lebih keset dan harum mengencangkan otot  otot miss v cocok untuk ibu menyusui melancarkan haid mendetox kotoran yang ada pada rahim,"['menjaga', 'kebersihan', 'miss', 'v', 'mencegah', 'keputihan', 'menghilangkan', 'bau', 'tak', 'sedap', 'menghilangkan', 'gatal', 'gatal', 'mengurangi', 'lendir', 'berlebih', 'merapatkan', 'miss', 'v', 'empot', 'empot', 'membuat', 'miss', 'v', 'lebih', 'keset', 'dan', 'harum', 'mengencangkan', 'otot', 'otot', 'miss', 'v', 'cocok', 'untuk', 'ibu', 'menyusui', 'melancarkan', 'haid', 'mendetox', 'kotoran', 'yang', 'ada', 'pada', 'rahim']","['menjaga', 'kebersihan', 'miss', 'v', 'mencegah', 'keputihan', 'menghilangkan', 'bau', 'sedap', 'menghilangkan', 'gatal', 'gatal', 'mengurangi', 'lendir', 'berlebih', 'merapatkan', 'miss', 'v', 'empot', 'empot', 'miss', 'v', 'keset', 'harum', 'mengencangkan', 'otot', 'otot', 'miss', 'v', 'cocok', 'menyusui', 'melancarkan', 'haid', 'mendetox', 'kotoran', 'rahim']","['jaga', 'bersih', 'miss', 'v', 'cegah', 'putih', 'hilang', 'bau', 'sedap', 'hilang', 'gatal', 'gatal', 'kurang', 'lendir', 'lebih', 'rapat', 'miss', 'v', 'empot', 'empot', 'miss', 'v', 'keset', 'harum', 'encang', 'otot', 'otot', 'miss', 'v', 'cocok', 'susu', 'lancar', 'haid', 'mendetox', 'kotor', 'rahim']"
ramuan tradisional madura,"asma, rematik, tekanan darah tinggi, kencing manis, kencing batu, ginjal, amandel, tumor, migrain, liver alergi maag, maag, lemah jantung, exim, kurang nafsu makan, kurang darah,  asam urat",CV.WAHYU ILLAHI,Jamu Kesehatan,189,"asma, rematik, tekanan darah tinggi, kencing manis, kencing batu, ginjal, amandel, tumor, migrain, liver alergi maag, maag, lemah jantung, exim, kurang nafsu makan, kurang darah,  asam urat",asma rematik tekanan darah tinggi kencing manis kencing batu ginjal amandel tumor migrain liver alergi maag maag lemah jantung exim kurang nafsu makan kurang darah  asam urat,"['asma', 'rematik', 'tekanan', 'darah', 'tinggi', 'kencing', 'manis', 'kencing', 'batu', 'ginjal', 'amandel', 'tumor', 'migrain', 'liver', 'alergi', 'maag', 'maag', 'lemah', 'jantung', 'exim', 'kurang', 'nafsu', 'makan', 'kurang', 'darah', 'asam', 'urat']","['asma', 'rematik', 'tekanan', 'darah', 'kencing', 'manis', 'kencing', 'batu', 'ginjal', 'amandel', 'tumor', 'migrain', 'liver', 'alergi', 'maag', 'maag', 'lemah', 'jantung', 'exim', 'nafsu', 'makan', 'darah', 'asam', 'urat']","['asma', 'rematik', 'tekan', 'darah', 'kencing', 'manis', 'kencing', 'batu', 'ginjal', 'amandel', 'tumor', 'migrain', 'liver', 'alergi', 'maag', 'maag', 'lemah', 'jantung', 'exim', 'nafsu', 'makan', 'darah', 'asam', 'urat']"
jamu sehat bugar,"Membantu menyembuhkan, Asma, Sebagai obat Rematik, Bisa mengobati Tekanan, Darah Tinggi, Dapat membantu menyembuhkan, Kencing Manis (diabetes), Dapat membantu menyembuhkan Kencing Batu, Bisa Membantu menyembuhkan Penyakit, Ginjal, Membantu menyembuhkan Amandel, Membantu Menyembuhkan,Tumor, Dapat membantu menyembuhkan, Migrain (sakit kepala), Bisa membantu menyembuhkan, Liver atau hepatitis, Dapat membantu menyembuhkan, Alergi, Bisa membantu menyembuhkan, Menyembuhkan Maag, Dapat membantu menyembuhkan, Lemah Jantung, Membantu , Mengobati Eksim (penyakit kulit), Menambah Nafsu makan, Bisa membantu menyembuhkan Kurang darah, Bisa membantu menyembuhkan Lemah, Syahwat, dan Dapat membantu menyembuhkan Asam Urat",CV.WAHYU ILLAHI,Jamu Kesehatan,714,"membantu menyembuhkan, asma, sebagai obat rematik, bisa mengobati tekanan, darah tinggi, dapat membantu menyembuhkan, kencing manis (diabetes), dapat membantu menyembuhkan kencing batu, bisa membantu menyembuhkan penyakit, ginjal, membantu menyembuhkan amandel, membantu menyembuhkan,tumor, dapat membantu menyembuhkan, migrain (sakit kepala), bisa membantu menyembuhkan, liver atau hepatitis, dapat membantu menyembuhkan, alergi, bisa membantu menyembuhkan, menyembuhkan maag, dapat membantu menyembuhkan, lemah jantung, membantu , mengobati eksim (penyakit kulit), menambah nafsu makan, bisa membantu menyembuhkan kurang darah, bisa membantu menyembuhkan lemah, syahwat, dan dapat membantu menyembuhkan asam urat",membantu menyembuhkan asma sebagai obat rematik bisa mengobati tekanan darah tinggi dapat membantu menyembuhkan kencing manis diabetes dapat membantu menyembuhkan kencing batu bisa membantu menyembuhkan penyakit ginjal membantu menyembuhkan amandel membantu menyembuhkantumor dapat membantu menyembuhkan migrain sakit kepala bisa membantu menyembuhkan liver atau hepatitis dapat membantu menyembuhkan alergi bisa membantu menyembuhkan menyembuhkan maag dapat membantu menyembuhkan lemah jantung membantu  mengobati eksim penyakit kulit menambah nafsu makan bisa membantu menyembuhkan kurang darah bisa membantu menyembuhkan lemah syahwat dan dapat membantu menyembuhkan asam urat,"['membantu', 'menyembuhkan', 'asma', 'sebagai', 'obat', 'rematik', 'bisa', 'mengobati', 'tekanan', 'darah', 'tinggi', 'dapat', 'membantu', 'menyembuhkan', 'kencing', 'manis', 'diabetes', 'dapat', 'membantu', 'menyembuhkan', 'kencing', 'batu', 'bisa', 'membantu', 'menyembuhkan', 'penyakit', 'ginjal', 'membantu', 'menyembuhkan', 'amandel', 'membantu', 'menyembuhkantumor', 'dapat', 'membantu', 'menyembuhkan', 'migrain', 'sakit', 'kepala', 'bisa', 'membantu', 'menyembuhkan', 'liver', 'atau', 'hepatitis', 'dapat', 'membantu', 'menyembuhkan', 'alergi', 'bisa', 'membantu', 'menyembuhkan', 'menyembuhkan', 'maag', 'dapat', 'membantu', 'menyembuhkan', 'lemah', 'jantung', 'membantu', 'mengobati', 'eksim', 'penyakit', 'kulit', 'menambah', 'nafsu', 'makan', 'bisa', 'membantu', 'menyembuhkan', 'kurang', 'darah', 'bisa', 'membantu', 'menyembuhkan', 'lemah', 'syahwat', 'dan', 'dapat', 'membantu', 'menyembuhkan', 'asam', 'urat']","['membantu', 'menyembuhkan', 'asma', 'obat', 'rematik', 'mengobati', 'tekanan', 'darah', 'membantu', 'menyembuhkan', 'kencing', 'manis', 'diabetes', 'membantu', 'menyembuhkan', 'kencing', 'batu', 'membantu', 'menyembuhkan', 'penyakit', 'ginjal', 'membantu', 'menyembuhkan', 'amandel', 'membantu', 'menyembuhkantumor', 'membantu', 'menyembuhkan', 'migrain', 'sakit', 'kepala', 'membantu', 'menyembuhkan', 'liver', 'hepatitis', 'membantu', 'menyembuhkan', 'alergi', 'membantu', 'menyembuhkan', 'menyembuhkan', 'maag', 'membantu', 'menyembuhkan', 'lemah', 'jantung', 'membantu', 'mengobati', 'eksim', 'penyakit', 'kulit', 'menambah', 'nafsu', 'makan', 'membantu', 'menyembuhkan', 'darah', 'membantu', 'menyembuhkan', 'lemah', 'syahwat', 'membantu', 'menyembuhkan', 'asam', 'urat']","['bantu', 'sembuh', 'asma', 'obat', 'rematik', 'obat', 'tekan', 'darah', 'bantu', 'sembuh', 'kencing', 'manis', 'diabetes', 'bantu', 'sembuh', 'kencing', 'batu', 'bantu', 'sembuh', 'sakit', 'ginjal', 'bantu', 'sembuh', 'amandel', 'bantu', 'menyembuhkantumor', 'bantu', 'sembuh', 'migrain', 'sakit', 'kepala', 'bantu', 'sembuh', 'liver', 'hepatitis', 'bantu', 'sembuh', 'alergi', 'bantu', 'sembuh', 'sembuh', 'maag', 'bantu', 'sembuh', 'lemah', 'jantung', 'bantu', 'obat', 'eksim', 'sakit', 'kulit', 'tambah', 'nafsu', 'makan', 'bantu', 'sembuh', 'darah', 'bantu', 'sembuh', 'lemah', 'syahwat', 'bantu', 'sembuh', 'asam', 'urat']"
galian singset (susut perut),untuk mengurangi lemak dalam tubuh,berkah madu/sumber madu,Jamu Kesehatan,34,untuk mengurangi lemak dalam tubuh,untuk mengurangi lemak dalam tubuh,"['untuk', 'mengurangi', 'lemak', 'dalam', 'tubuh']","['mengurangi', 'lemak', 'tubuh']","['kurang', 'lemak', 'tubuh']"
super empot,"Mengencangkan kembali otot otot kewanitaan, Mengurangi lendir berlebihan pada daerah kewanitaan, Memberikan kepuasan hubungan suami istri, Menjaga kesehatan wanita, Menjaga agar awet muda.",berkah madu/sumber madu,Jamu Pasutri,188,"mengencangkan kembali otot otot kewanitaan, mengurangi lendir berlebihan pada daerah kewanitaan, memberikan kepuasan hubungan suami istri, menjaga kesehatan wanita, menjaga agar awet muda.",mengencangkan kembali otot otot kewanitaan mengurangi lendir berlebihan pada daerah kewanitaan memberikan kepuasan hubungan suami istri menjaga kesehatan wanita menjaga agar awet muda,"['mengencangkan', 'kembali', 'otot', 'otot', 'kewanitaan', 'mengurangi', 'lendir', 'berlebihan', 'pada', 'daerah', 'kewanitaan', 'memberikan', 'kepuasan', 'hubungan', 'suami', 'istri', 'menjaga', 'kesehatan', 'wanita', 'menjaga', 'agar', 'awet', 'muda']","['mengencangkan', 'otot', 'otot', 'kewanitaan', 'mengurangi', 'lendir', 'daerah', 'kewanitaan', 'kepuasan', 'hubungan', 'suami', 'istri', 'menjaga', 'kesehatan', 'wanita', 'menjaga', 'awet', 'muda']","['encang', 'otot', 'otot', 'wanita', 'kurang', 'lendir', 'daerah', 'wanita', 'puas', 'hubung', 'suami', 'istri', 'jaga', 'sehat', 'wanita', 'jaga', 'awet', 'muda']"
super rapet,membantu mengurangi lendir,berkah madu/sumber madu,Jamu Perawatan Kewanitaan,26,membantu mengurangi lendir,membantu mengurangi lendir,"['membantu', 'mengurangi', 'lendir']","['membantu', 'mengurangi', 'lendir']","['bantu', 'kurang', 'lendir']"
JAMU PEGEL LINU,mengatasi gatal - gatal dan bau yang kurang sedap pada wanita,berkah madu/sumber madu,Jamu Perawatan Kewanitaan,61,mengatasi gatal - gatal dan bau yang kurang sedap pada wanita,mengatasi gatal  gatal dan bau yang kurang sedap pada wanita,"['mengatasi', 'gatal', 'gatal', 'dan', 'bau', 'yang', 'kurang', 'sedap', 'pada', 'wanita']","['mengatasi', 'gatal', 'gatal', 'bau', 'sedap', 'wanita']","['atas', 'gatal', 'gatal', 'bau', 'sedap', 'wanita']"
galian rapet,rapat mencengkram saat berhubungan intim.hingga melestarikan hubungan suami istri ,berkah madu/sumber madu,Jamu Pasutri,82,rapat mencengkram saat berhubungan intim.hingga melestarikan hubungan suami istri ,rapat mencengkram saat berhubungan intimhingga melestarikan hubungan suami istri ,"['rapat', 'mencengkram', 'saat', 'berhubungan', 'intimhingga', 'melestarikan', 'hubungan', 'suami', 'istri']","['rapat', 'mencengkram', 'berhubungan', 'intimhingga', 'melestarikan', 'hubungan', 'suami', 'istri']","['rapat', 'mencengkram', 'hubung', 'intimhingga', 'lestari', 'hubung', 'suami', 'istri']"
jamu dalimah putih,dan selalu awet muda bagi perempuan,berkah madu/sumber madu,Jamu Perawatan Kewanitaan,35,dan selalu awet muda bagi perempuan,dan selalu awet muda bagi perempuan,"['dan', 'selalu', 'awet', 'muda', 'bagi', 'perempuan']","['awet', 'muda', 'perempuan']","['awet', 'muda', 'perempuan']"
GALIAN SEHAT / MONTOK,"Pil jamu ramuan Madura untuk wanita / pria yang kurang nafsu makan, berbadan kurus, muka pucat, sering sakit, badan lemah dan lain-lain. Minumlah jamu ini secara teratur supaya badan jadi sehat, segar dan montok padat berisi.",berkah madu/sumber madu,Jamu Kesehatan,225,"pil jamu ramuan madura untuk wanita / pria yang kurang nafsu makan, berbadan kurus, muka pucat, sering sakit, badan lemah dan lain-lain. minumlah jamu ini secara teratur supaya badan jadi sehat, segar dan montok padat berisi.",pil jamu ramuan madura untuk wanita  pria yang kurang nafsu makan berbadan kurus muka pucat sering sakit badan lemah dan lainlain minumlah jamu ini secara teratur supaya badan jadi sehat segar dan montok padat berisi,"['pil', 'jamu', 'ramuan', 'madura', 'untuk', 'wanita', 'pria', 'yang', 'kurang', 'nafsu', 'makan', 'berbadan', 'kurus', 'muka', 'pucat', 'sering', 'sakit', 'badan', 'lemah', 'dan', 'lainlain', 'minumlah', 'jamu', 'ini', 'secara', 'teratur', 'supaya', 'badan', 'jadi', 'sehat', 'segar', 'dan', 'montok', 'padat', 'berisi']","['pil', 'jamu', 'ramuan', 'madura', 'wanita', 'pria', 'nafsu', 'makan', 'berbadan', 'kurus', 'muka', 'pucat', 'sakit', 'badan', 'lemah', 'lainlain', 'minumlah', 'jamu', 'teratur', 'badan', 'sehat', 'segar', 'montok', 'padat', 'berisi']","['pil', 'jamu', 'ramu', 'madura', 'wanita', 'pria', 'nafsu', 'makan', 'badan', 'kurus', 'muka', 'pucat', 'sakit', 'badan', 'lemah', 'lainlain', 'minum', 'jamu', 'atur', 'badan', 'sehat', 'segar', 'montok', 'padat', 'isi']"
minyak zaitun,"Mengencangkan dan menghaluskan kulit muka dan seluruh tubuh (kulit bersisik, pecah-pecah dan kasar), dan sebagai pengganti pelembab dan bisa juga untuk minyak urut/pijat baik untuk dewasa dan anak/bayi.",berkah madu/sumber madu,Jamu Kesehatan,202,"mengencangkan dan menghaluskan kulit muka dan seluruh tubuh (kulit bersisik, pecah-pecah dan kasar), dan sebagai pengganti pelembab dan bisa juga untuk minyak urut/pijat baik untuk dewasa dan anak/bayi.",mengencangkan dan menghaluskan kulit muka dan seluruh tubuh kulit bersisik pecahpecah dan kasar dan sebagai pengganti pelembab dan bisa juga untuk minyak urutpijat baik untuk dewasa dan anakbayi,"['mengencangkan', 'dan', 'menghaluskan', 'kulit', 'muka', 'dan', 'seluruh', 'tubuh', 'kulit', 'bersisik', 'pecahpecah', 'dan', 'kasar', 'dan', 'sebagai', 'pengganti', 'pelembab', 'dan', 'bisa', 'juga', 'untuk', 'minyak', 'urutpijat', 'baik', 'untuk', 'dewasa', 'dan', 'anakbayi']","['mengencangkan', 'menghaluskan', 'kulit', 'muka', 'tubuh', 'kulit', 'bersisik', 'pecahpecah', 'kasar', 'pengganti', 'pelembab', 'minyak', 'urutpijat', 'dewasa', 'anakbayi']","['encang', 'halus', 'kulit', 'muka', 'tubuh', 'kulit', 'sisik', 'pecahpecah', 'kasar', 'ganti', 'pelembab', 'minyak', 'urutpijat', 'dewasa', 'anakbayi']"
super pria,"Menyembuhkan lemah syahwat dan impotensi pada laki laki, Menambah gairah bagi pria.",berkah madu/sumber madu,Jamu Pasutri,83,"menyembuhkan lemah syahwat dan impotensi pada laki laki, menambah gairah bagi pria.",menyembuhkan lemah syahwat dan impotensi pada laki laki menambah gairah bagi pria,"['menyembuhkan', 'lemah', 'syahwat', 'dan', 'impotensi', 'pada', 'laki', 'laki', 'menambah', 'gairah', 'bagi', 'pria']","['menyembuhkan', 'lemah', 'syahwat', 'impotensi', 'laki', 'laki', 'menambah', 'gairah', 'pria']","['sembuh', 'lemah', 'syahwat', 'impotensi', 'laki', 'laki', 'tambah', 'gairah', 'pria']"
empot v,"mampu melancarkan menstruasi, mengencangkan kulit,mengatasi payudara kendur, mengencangkan miss-v, mengobati kista, mencegah kanker payudara, menguatkan pinggang, membersihkan bakteri dan jamur pada miss-v (keputihan)",PT. Firdaus,Jamu Perawatan Kewanitaan,217,"mampu melancarkan menstruasi, mengencangkan kulit,mengatasi payudara kendur, mengencangkan miss-v, mengobati kista, mencegah kanker payudara, menguatkan pinggang, membersihkan bakteri dan jamur pada miss-v (keputihan)",mampu melancarkan menstruasi mengencangkan kulitmengatasi payudara kendur mengencangkan missv mengobati kista mencegah kanker payudara menguatkan pinggang membersihkan bakteri dan jamur pada missv keputihan,"['mampu', 'melancarkan', 'menstruasi', 'mengencangkan', 'kulitmengatasi', 'payudara', 'kendur', 'mengencangkan', 'missv', 'mengobati', 'kista', 'mencegah', 'kanker', 'payudara', 'menguatkan', 'pinggang', 'membersihkan', 'bakteri', 'dan', 'jamur', 'pada', 'missv', 'keputihan']","['melancarkan', 'menstruasi', 'mengencangkan', 'kulitmengatasi', 'payudara', 'kendur', 'mengencangkan', 'missv', 'mengobati', 'kista', 'mencegah', 'kanker', 'payudara', 'menguatkan', 'pinggang', 'membersihkan', 'bakteri', 'jamur', 'missv', 'keputihan']","['lancar', 'menstruasi', 'encang', 'kulitmengatasi', 'payudara', 'kendur', 'encang', 'missv', 'obat', 'kista', 'cegah', 'kanker', 'payudara', 'kuat', 'pinggang', 'bersih', 'bakteri', 'jamur', 'missv', 'putih']"
galian montok,"mampu mengencangkan dan membesarkan payudara, menjaga tubuh ideal, mengencangkan dan menghaluskan kulit agar tetap awet muda",PT. Firdaus,Jamu Perawatan Kewanitaan,124,"mampu mengencangkan dan membesarkan payudara, menjaga tubuh ideal, mengencangkan dan menghaluskan kulit agar tetap awet muda",mampu mengencangkan dan membesarkan payudara menjaga tubuh ideal mengencangkan dan menghaluskan kulit agar tetap awet muda,"['mampu', 'mengencangkan', 'dan', 'membesarkan', 'payudara', 'menjaga', 'tubuh', 'ideal', 'mengencangkan', 'dan', 'menghaluskan', 'kulit', 'agar', 'tetap', 'awet', 'muda']","['mengencangkan', 'membesarkan', 'payudara', 'menjaga', 'tubuh', 'ideal', 'mengencangkan', 'menghaluskan', 'kulit', 'awet', 'muda']","['encang', 'besar', 'payudara', 'jaga', 'tubuh', 'ideal', 'encang', 'halus', 'kulit', 'awet', 'muda']"
harum asmara,"Merapatkan & melunturkan miss v, mengatasi bau tidak sedap, serta gatal gatal di organ intim, mengatasi cairan berlebihan, mengharumkan area vagina, menyembuhkan keputihan",PT. Firdaus,Jamu Perawatan Kewanitaan,171,"merapatkan & melunturkan miss v, mengatasi bau tidak sedap, serta gatal gatal di organ intim, mengatasi cairan berlebihan, mengharumkan area vagina, menyembuhkan keputihan",merapatkan  melunturkan miss v mengatasi bau tidak sedap serta gatal gatal di organ intim mengatasi cairan berlebihan mengharumkan area vagina menyembuhkan keputihan,"['merapatkan', 'melunturkan', 'miss', 'v', 'mengatasi', 'bau', 'tidak', 'sedap', 'serta', 'gatal', 'gatal', 'di', 'organ', 'intim', 'mengatasi', 'cairan', 'berlebihan', 'mengharumkan', 'area', 'vagina', 'menyembuhkan', 'keputihan']","['merapatkan', 'melunturkan', 'miss', 'v', 'mengatasi', 'bau', 'sedap', 'gatal', 'gatal', 'organ', 'intim', 'mengatasi', 'cairan', 'mengharumkan', 'area', 'vagina', 'menyembuhkan', 'keputihan']","['rapat', 'luntur', 'miss', 'v', 'atas', 'bau', 'sedap', 'gatal', 'gatal', 'organ', 'intim', 'atas', 'cair', 'harum', 'area', 'vagina', 'sembuh', 'putih']"
Jamu sehat wanita,"Menambah stamina, menjaga kesehatan tubuh khusus wanita",PT. Firdaus,Jamu Perawatan Kewanitaan,55,"menambah stamina, menjaga kesehatan tubuh khusus wanita",menambah stamina menjaga kesehatan tubuh khusus wanita,"['menambah', 'stamina', 'menjaga', 'kesehatan', 'tubuh', 'khusus', 'wanita']","['menambah', 'stamina', 'menjaga', 'kesehatan', 'tubuh', 'khusus', 'wanita']","['tambah', 'stamina', 'jaga', 'sehat', 'tubuh', 'khusus', 'wanita']"
galian singset,"Mengurangi kelebihan lemak pada bagian perut, paha dan kaki. Mengecilkan Perut dan Menjaga bentuk tubuh Ideal ,Meningkatkan hormon tubuh pada bagian kewanitaan.  Mencerahkan, menyegarkan kulit dan Mengencangkan kulit  Menjaga Penampilan selalu Awet Muda, Menghilangkan aroma badan yang tidak sedap sehingga tubuh jadi harum dan wangi ,Membuat tampil seksi & percaya diri",PT. Firdaus,Jamu Perawatan Kewanitaan,370,"mengurangi kelebihan lemak pada bagian perut, paha dan kaki. mengecilkan perut dan menjaga bentuk tubuh ideal ,meningkatkan hormon tubuh pada bagian kewanitaan.  mencerahkan, menyegarkan kulit dan mengencangkan kulit  menjaga penampilan selalu awet muda, menghilangkan aroma badan yang tidak sedap sehingga tubuh jadi harum dan wangi ,membuat tampil seksi & percaya diri",mengurangi kelebihan lemak pada bagian perut paha dan kaki mengecilkan perut dan menjaga bentuk tubuh ideal meningkatkan hormon tubuh pada bagian kewanitaan  mencerahkan menyegarkan kulit dan mengencangkan kulit  menjaga penampilan selalu awet muda menghilangkan aroma badan yang tidak sedap sehingga tubuh jadi harum dan wangi membuat tampil seksi  percaya diri,"['mengurangi', 'kelebihan', 'lemak', 'pada', 'bagian', 'perut', 'paha', 'dan', 'kaki', 'mengecilkan', 'perut', 'dan', 'menjaga', 'bentuk', 'tubuh', 'ideal', 'meningkatkan', 'hormon', 'tubuh', 'pada', 'bagian', 'kewanitaan', 'mencerahkan', 'menyegarkan', 'kulit', 'dan', 'mengencangkan', 'kulit', 'menjaga', 'penampilan', 'selalu', 'awet', 'muda', 'menghilangkan', 'aroma', 'badan', 'yang', 'tidak', 'sedap', 'sehingga', 'tubuh', 'jadi', 'harum', 'dan', 'wangi', 'membuat', 'tampil', 'seksi', 'percaya', 'diri']","['mengurangi', 'kelebihan', 'lemak', 'perut', 'paha', 'kaki', 'mengecilkan', 'perut', 'menjaga', 'bentuk', 'tubuh', 'ideal', 'meningkatkan', 'hormon', 'tubuh', 'kewanitaan', 'mencerahkan', 'menyegarkan', 'kulit', 'mengencangkan', 'kulit', 'menjaga', 'penampilan', 'awet', 'muda', 'menghilangkan', 'aroma', 'badan', 'sedap', 'tubuh', 'harum', 'wangi', 'tampil', 'seksi', 'percaya']","['kurang', 'lebih', 'lemak', 'perut', 'paha', 'kaki', 'kecil', 'perut', 'jaga', 'bentuk', 'tubuh', 'ideal', 'tingkat', 'hormon', 'tubuh', 'wanita', 'cerah', 'segar', 'kulit', 'encang', 'kulit', 'jaga', 'tampil', 'awet', 'muda', 'hilang', 'aroma', 'badan', 'sedap', 'tubuh', 'harum', 'wangi', 'tampil', 'seksi', 'percaya']"
penyubur ,"menguatkan rahim, menambah hormon menyuburkan kandungan",PT. Firdaus,Jamu Perawatan Kewanitaan,55,"menguatkan rahim, menambah hormon menyuburkan kandungan",menguatkan rahim menambah hormon menyuburkan kandungan,"['menguatkan', 'rahim', 'menambah', 'hormon', 'menyuburkan', 'kandungan']","['menguatkan', 'rahim', 'menambah', 'hormon', 'menyuburkan', 'kandungan']","['kuat', 'rahim', 'tambah', 'hormon', 'subur', 'kandung']"
