Nama,Khasiat,Produsen,Kategori,Khasiat_Length,Case_folding,punctuation_removal,tokenizing,stopwordremoval,stemming
setanggi zahra,bermanfaat sebagai aromatherapy menenangkan  hati dan menambah keintiman suami istri,PT. Firdaus,Jamu Pasutri,84,bermanfaat sebagai aromatherapy menenangkan  hati dan menambah keintiman suami istri,bermanfaat sebagai aromatherapy menenangkan  hati dan menambah keintiman suami istri,"['bermanfaat', 'sebagai', 'aromatherapy', 'menenangkan', 'hati', 'dan', 'menambah', 'keintiman', 'suami', 'istri']","['bermanfaat', 'aromatherapy', 'menenangkan', 'hati', 'menambah', 'keintiman', 'suami', 'istri']","['manfaat', 'aromatherapy', 'tenang', 'hati', 'tambah', 'intim', 'suami', 'istri']"
timung / mandi uap,"melancarkan peredaran darah, mengeluarkan keringat berlebih, membakar lemak, mengharumkan badan, membuat badan segar, harum dan berseri",PT. Firdaus,Jamu Kesehatan,135,"melancarkan peredaran darah, mengeluarkan keringat berlebih, membakar lemak, mengharumkan badan, membuat badan segar, harum dan berseri",melancarkan peredaran darah mengeluarkan keringat berlebih membakar lemak mengharumkan badan membuat badan segar harum dan berseri,"['melancarkan', 'peredaran', 'darah', 'mengeluarkan', 'keringat', 'berlebih', 'membakar', 'lemak', 'mengharumkan', 'badan', 'membuat', 'badan', 'segar', 'harum', 'dan', 'berseri']","['melancarkan', 'peredaran', 'darah', 'mengeluarkan', 'keringat', 'berlebih', 'membakar', 'lemak', 'mengharumkan', 'badan', 'badan', 'segar', 'harum', 'berseri']","['lancar', 'edar', 'darah', 'keluar', 'keringat', 'lebih', 'bakar', 'lemak', 'harum', 'badan', 'badan', 'segar', 'harum', 'seri']"
hormolak,"menstabilkan hormon laki - laki yang sangat diperlukan untuk produksi sperma, memberikan suplemen  tambahan sehingga produksi sperma dapat lebih maksimal, mempercepat produksi sperma dan memperbanyak jumlah cairan sperma, menghangatkan badan, mengurangi ejakulasi dini",PT. Firdaus,Jamu Pasutri,268,"menstabilkan hormon laki - laki yang sangat diperlukan untuk produksi sperma, memberikan suplemen  tambahan sehingga produksi sperma dapat lebih maksimal, mempercepat produksi sperma dan memperbanyak jumlah cairan sperma, menghangatkan badan, mengurangi ejakulasi dini",menstabilkan hormon laki  laki yang sangat diperlukan untuk produksi sperma memberikan suplemen  tambahan sehingga produksi sperma dapat lebih maksimal mempercepat produksi sperma dan memperbanyak jumlah cairan sperma menghangatkan badan mengurangi ejakulasi dini,"['menstabilkan', 'hormon', 'laki', 'laki', 'yang', 'sangat', 'diperlukan', 'untuk', 'produksi', 'sperma', 'memberikan', 'suplemen', 'tambahan', 'sehingga', 'produksi', 'sperma', 'dapat', 'lebih', 'maksimal', 'mempercepat', 'produksi', 'sperma', 'dan', 'memperbanyak', 'jumlah', 'cairan', 'sperma', 'menghangatkan', 'badan', 'mengurangi', 'ejakulasi', 'dini']","['menstabilkan', 'hormon', 'laki', 'laki', 'produksi', 'sperma', 'suplemen', 'tambahan', 'produksi', 'sperma', 'maksimal', 'mempercepat', 'produksi', 'sperma', 'memperbanyak', 'cairan', 'sperma', 'menghangatkan', 'badan', 'mengurangi', 'ejakulasi']","['stabil', 'hormon', 'laki', 'laki', 'produksi', 'sperma', 'suplemen', 'tambah', 'produksi', 'sperma', 'maksimal', 'cepat', 'produksi', 'sperma', 'banyak', 'cair', 'sperma', 'hangat', 'badan', 'kurang', 'ejakulasi']"
lintah hitam papua,"melancarkan sirkulasi darah, mengencangkan otot - otot yang kendur, meningkatkan kejantanan pria, mengobati lemah syahwat, ejakulasi dini, memperbesar dan memperpanjang penis.",PT. Firdaus,Jamu Pasutri,175,"melancarkan sirkulasi darah, mengencangkan otot - otot yang kendur, meningkatkan kejantanan pria, mengobati lemah syahwat, ejakulasi dini, memperbesar dan memperpanjang penis.",melancarkan sirkulasi darah mengencangkan otot  otot yang kendur meningkatkan kejantanan pria mengobati lemah syahwat ejakulasi dini memperbesar dan memperpanjang penis,"['melancarkan', 'sirkulasi', 'darah', 'mengencangkan', 'otot', 'otot', 'yang', 'kendur', 'meningkatkan', 'kejantanan', 'pria', 'mengobati', 'lemah', 'syahwat', 'ejakulasi', 'dini', 'memperbesar', 'dan', 'memperpanjang', 'penis']","['melancarkan', 'sirkulasi', 'darah', 'mengencangkan', 'otot', 'otot', 'kendur', 'meningkatkan', 'kejantanan', 'pria', 'mengobati', 'lemah', 'syahwat', 'ejakulasi', 'memperbesar', 'memperpanjang', 'penis']","['lancar', 'sirkulasi', 'darah', 'encang', 'otot', 'otot', 'kendur', 'tingkat', 'jantan', 'pria', 'obat', 'lemah', 'syahwat', 'ejakulasi', 'besar', 'panjang', 'penis']"
jamu gemuk sehat,"membantu memperbaiki nafsu makan, menambah berat badan, menyelaraskan alat-alat pencernaan tubuh, menghilangkan letih, lesu, lemah dan kurang bersemangat",ribkah maryam jokotole,Jamu Kesehatan,153,"membantu memperbaiki nafsu makan, menambah berat badan, menyelaraskan alat-alat pencernaan tubuh, menghilangkan letih, lesu, lemah dan kurang bersemangat",membantu memperbaiki nafsu makan menambah berat badan menyelaraskan alatalat pencernaan tubuh menghilangkan letih lesu lemah dan kurang bersemangat,"['membantu', 'memperbaiki', 'nafsu', 'makan', 'menambah', 'berat', 'badan', 'menyelaraskan', 'alatalat', 'pencernaan', 'tubuh', 'menghilangkan', 'letih', 'lesu', 'lemah', 'dan', 'kurang', 'bersemangat']","['membantu', 'memperbaiki', 'nafsu', 'makan', 'menambah', 'berat', 'badan', 'menyelaraskan', 'alatalat', 'pencernaan', 'tubuh', 'menghilangkan', 'letih', 'lesu', 'lemah', 'bersemangat']","['bantu', 'baik', 'nafsu', 'makan', 'tambah', 'berat', 'badan', 'selaras', 'alatalat', 'cerna', 'tubuh', 'hilang', 'letih', 'lesu', 'lemah', 'semangat']"
jamu sepet madura *empot-empot),"membantu mengurangi lendir yang berlebihan pada daerah kewanitaan, memperkuat otot - otot vagina untuk membuat denyut - denyut istimewa pada vagina, mengeraskan otot vagina, menghilangkan keputihan dan gatal - gatal",ribkah maryam jokotole,Jamu Perawatan Kewanitaan,215,"membantu mengurangi lendir yang berlebihan pada daerah kewanitaan, memperkuat otot - otot vagina untuk membuat denyut - denyut istimewa pada vagina, mengeraskan otot vagina, menghilangkan keputihan dan gatal - gatal",membantu mengurangi lendir yang berlebihan pada daerah kewanitaan memperkuat otot  otot vagina untuk membuat denyut  denyut istimewa pada vagina mengeraskan otot vagina menghilangkan keputihan dan gatal  gatal,"['membantu', 'mengurangi', 'lendir', 'yang', 'berlebihan', 'pada', 'daerah', 'kewanitaan', 'memperkuat', 'otot', 'otot', 'vagina', 'untuk', 'membuat', 'denyut', 'denyut', 'istimewa', 'pada', 'vagina', 'mengeraskan', 'otot', 'vagina', 'menghilangkan', 'keputihan', 'dan', 'gatal', 'gatal']","['membantu', 'mengurangi', 'lendir', 'daerah', 'kewanitaan', 'memperkuat', 'otot', 'otot', 'vagina', 'denyut', 'denyut', 'istimewa', 'vagina', 'mengeraskan', 'otot', 'vagina', 'menghilangkan', 'keputihan', 'gatal', 'gatal']","['bantu', 'kurang', 'lendir', 'daerah', 'wanita', 'kuat', 'otot', 'otot', 'vagina', 'denyut', 'denyut', 'istimewa', 'vagina', 'keras', 'otot', 'vagina', 'hilang', 'putih', 'gatal', 'gatal']"
PLUNTUR(TERLAMBAT BULAN),"sangat efektif untuk wanita yang sering terlambat bulan, datang bulan tidak teratur, sakit badan pada waktu datang bulan (dianjurkan untuk keterlambat) yang tidak lebih dari tiga bulan",ribkah maryam jokotole,Jamu Perawatan Kewanitaan,184,"sangat efektif untuk wanita yang sering terlambat bulan, datang bulan tidak teratur, sakit badan pada waktu datang bulan (dianjurkan untuk keterlambat) yang tidak lebih dari tiga bulan",sangat efektif untuk wanita yang sering terlambat bulan datang bulan tidak teratur sakit badan pada waktu datang bulan dianjurkan untuk keterlambat yang tidak lebih dari tiga bulan,"['sangat', 'efektif', 'untuk', 'wanita', 'yang', 'sering', 'terlambat', 'bulan', 'datang', 'bulan', 'tidak', 'teratur', 'sakit', 'badan', 'pada', 'waktu', 'datang', 'bulan', 'dianjurkan', 'untuk', 'keterlambat', 'yang', 'tidak', 'lebih', 'dari', 'tiga', 'bulan']","['efektif', 'wanita', 'terlambat', 'teratur', 'sakit', 'badan', 'dianjurkan', 'keterlambat']","['efektif', 'wanita', 'lambat', 'atur', 'sakit', 'badan', 'anjur', 'lambat']"
Jamu Tradisional Madura,"amandel, tekanan darah tinggi, asma, kencing batu, liver, alergi, lemah jantung, kurang nafsu makan, asam urat, pegal linu, kencing manis, ginjal, rematik, sakit gigi, maag, eksim, kurang darah",wahyu sejati,Jamu Kesehatan,193,"amandel, tekanan darah tinggi, asma, kencing batu, liver, alergi, lemah jantung, kurang nafsu makan, asam urat, pegal linu, kencing manis, ginjal, rematik, sakit gigi, maag, eksim, kurang darah",amandel tekanan darah tinggi asma kencing batu liver alergi lemah jantung kurang nafsu makan asam urat pegal linu kencing manis ginjal rematik sakit gigi maag eksim kurang darah,"['amandel', 'tekanan', 'darah', 'tinggi', 'asma', 'kencing', 'batu', 'liver', 'alergi', 'lemah', 'jantung', 'kurang', 'nafsu', 'makan', 'asam', 'urat', 'pegal', 'linu', 'kencing', 'manis', 'ginjal', 'rematik', 'sakit', 'gigi', 'maag', 'eksim', 'kurang', 'darah']","['amandel', 'tekanan', 'darah', 'asma', 'kencing', 'batu', 'liver', 'alergi', 'lemah', 'jantung', 'nafsu', 'makan', 'asam', 'urat', 'pegal', 'linu', 'kencing', 'manis', 'ginjal', 'rematik', 'sakit', 'gigi', 'maag', 'eksim', 'darah']","['amandel', 'tekan', 'darah', 'asma', 'kencing', 'batu', 'liver', 'alergi', 'lemah', 'jantung', 'nafsu', 'makan', 'asam', 'urat', 'pegal', 'linu', 'kencing', 'manis', 'ginjal', 'rematik', 'sakit', 'gigi', 'maag', 'eksim', 'darah']"
Lulur Bengkoang,"mengangkat sel-sel kulit mati, menghilangkan jerawat, flek hitam juga memutihkan kulit",IBU MASTURAH,Jamu Kesehatan,86,"mengangkat sel-sel kulit mati, menghilangkan jerawat, flek hitam juga memutihkan kulit",mengangkat selsel kulit mati menghilangkan jerawat flek hitam juga memutihkan kulit,"['mengangkat', 'selsel', 'kulit', 'mati', 'menghilangkan', 'jerawat', 'flek', 'hitam', 'juga', 'memutihkan', 'kulit']","['mengangkat', 'selsel', 'kulit', 'mati', 'menghilangkan', 'jerawat', 'flek', 'hitam', 'memutihkan', 'kulit']","['angkat', 'selsel', 'kulit', 'mati', 'hilang', 'jerawat', 'flek', 'hitam', 'mutih', 'kulit']"
pintu surga,bermanfaat untuk perawatan kewanitaan dan juga menuntaskan keputihan,IBU MASTURAH,Jamu Perawatan Kewanitaan,68,bermanfaat untuk perawatan kewanitaan dan juga menuntaskan keputihan,bermanfaat untuk perawatan kewanitaan dan juga menuntaskan keputihan,"['bermanfaat', 'untuk', 'perawatan', 'kewanitaan', 'dan', 'juga', 'menuntaskan', 'keputihan']","['bermanfaat', 'perawatan', 'kewanitaan', 'menuntaskan', 'keputihan']","['manfaat', 'awat', 'wanita', 'tuntas', 'putih']"
jamu manjakani,"merapatkan vagina, bikin keset untuk keputihan dan juga menyehatkan badan",IBU MASTURAH,Jamu Perawatan Kewanitaan,73,"merapatkan vagina, bikin keset untuk keputihan dan juga menyehatkan badan",merapatkan vagina bikin keset untuk keputihan dan juga menyehatkan badan,"['merapatkan', 'vagina', 'bikin', 'keset', 'untuk', 'keputihan', 'dan', 'juga', 'menyehatkan', 'badan']","['merapatkan', 'vagina', 'bikin', 'keset', 'keputihan', 'menyehatkan', 'badan']","['rapat', 'vagina', 'bikin', 'keset', 'putih', 'sehat', 'badan']"
air cewok,"bikin keset, merapatkan, menghilangkan keputihan juga menghilangkan bau daerah v",IBU MASTURAH,Jamu Perawatan Kewanitaan,80,"bikin keset, merapatkan, menghilangkan keputihan juga menghilangkan bau daerah v",bikin keset merapatkan menghilangkan keputihan juga menghilangkan bau daerah v,"['bikin', 'keset', 'merapatkan', 'menghilangkan', 'keputihan', 'juga', 'menghilangkan', 'bau', 'daerah', 'v']","['bikin', 'keset', 'merapatkan', 'menghilangkan', 'keputihan', 'menghilangkan', 'bau', 'daerah', 'v']","['bikin', 'keset', 'rapat', 'hilang', 'putih', 'hilang', 'bau', 'daerah', 'v']"
jamu melahirkan,ibu dan bayi menjadi sehat dan bugar,H. Mifki,Jamu Perawatan Kewanitaan,36,ibu dan bayi menjadi sehat dan bugar,ibu dan bayi menjadi sehat dan bugar,"['ibu', 'dan', 'bayi', 'menjadi', 'sehat', 'dan', 'bugar']","['bayi', 'sehat', 'bugar']","['bayi', 'sehat', 'bugar']"
sehat lelaki,"hubungan suami istri lebih intim, untuk kejantanan lelaki",H. Mifki,Jamu Pasutri,57,"hubungan suami istri lebih intim, untuk kejantanan lelaki",hubungan suami istri lebih intim untuk kejantanan lelaki,"['hubungan', 'suami', 'istri', 'lebih', 'intim', 'untuk', 'kejantanan', 'lelaki']","['hubungan', 'suami', 'istri', 'intim', 'kejantanan', 'lelaki']","['hubung', 'suami', 'istri', 'intim', 'jantan', 'lelaki']"
sehat wanita,"untuk keputihan, stamina wanita, hubungan suami istri lebih intim",H. Mifki,Jamu Pasutri,65,"untuk keputihan, stamina wanita, hubungan suami istri lebih intim",untuk keputihan stamina wanita hubungan suami istri lebih intim,"['untuk', 'keputihan', 'stamina', 'wanita', 'hubungan', 'suami', 'istri', 'lebih', 'intim']","['keputihan', 'stamina', 'wanita', 'hubungan', 'suami', 'istri', 'intim']","['putih', 'stamina', 'wanita', 'hubung', 'suami', 'istri', 'intim']"
salekarang,"untuk flu, batuk, sakit gigi, pusing",H. Mifki,Jamu Kesehatan,36,"untuk flu, batuk, sakit gigi, pusing",untuk flu batuk sakit gigi pusing,"['untuk', 'flu', 'batuk', 'sakit', 'gigi', 'pusing']","['flu', 'batuk', 'sakit', 'gigi', 'pusing']","['flu', 'batuk', 'sakit', 'gigi', 'pusing']"
Kopi racikan madura,"Menjaga organ hati, membantu membersihkan saluran pencernaan, membantu membakar lemak, mencegah penyakit jantung, diabetes",IBU MASTURAH,Jamu Kesehatan,122,"menjaga organ hati, membantu membersihkan saluran pencernaan, membantu membakar lemak, mencegah penyakit jantung, diabetes",menjaga organ hati membantu membersihkan saluran pencernaan membantu membakar lemak mencegah penyakit jantung diabetes,"['menjaga', 'organ', 'hati', 'membantu', 'membersihkan', 'saluran', 'pencernaan', 'membantu', 'membakar', 'lemak', 'mencegah', 'penyakit', 'jantung', 'diabetes']","['menjaga', 'organ', 'hati', 'membantu', 'membersihkan', 'saluran', 'pencernaan', 'membantu', 'membakar', 'lemak', 'mencegah', 'penyakit', 'jantung', 'diabetes']","['jaga', 'organ', 'hati', 'bantu', 'bersih', 'salur', 'cerna', 'bantu', 'bakar', 'lemak', 'cegah', 'sakit', 'jantung', 'diabetes']"
dupa kemanten,"mengharumkan tubuh, baju, juga ruangan. Harumnya lengket sepanjang hari",IBU MASTURAH,Jamu Kesehatan,71,"mengharumkan tubuh, baju, juga ruangan. harumnya lengket sepanjang hari",mengharumkan tubuh baju juga ruangan harumnya lengket sepanjang hari,"['mengharumkan', 'tubuh', 'baju', 'juga', 'ruangan', 'harumnya', 'lengket', 'sepanjang', 'hari']","['mengharumkan', 'tubuh', 'baju', 'ruangan', 'harumnya', 'lengket']","['harum', 'tubuh', 'baju', 'ruang', 'harum', 'lengket']"
galian singset,"membantu mengurangi lemak, membuat badan menjadi langsing",ribkah maryam jokotole,Jamu Kesehatan,57,"membantu mengurangi lemak, membuat badan menjadi langsing",membantu mengurangi lemak membuat badan menjadi langsing,"['membantu', 'mengurangi', 'lemak', 'membuat', 'badan', 'menjadi', 'langsing']","['membantu', 'mengurangi', 'lemak', 'badan', 'langsing']","['bantu', 'kurang', 'lemak', 'badan', 'langsing']"
jamu jerawat,"membantu mengatasi jerawat, menjaga kulit tetap halus bercahaya",ribkah maryam jokotole,Jamu Kesehatan,63,"membantu mengatasi jerawat, menjaga kulit tetap halus bercahaya",membantu mengatasi jerawat menjaga kulit tetap halus bercahaya,"['membantu', 'mengatasi', 'jerawat', 'menjaga', 'kulit', 'tetap', 'halus', 'bercahaya']","['membantu', 'mengatasi', 'jerawat', 'menjaga', 'kulit', 'halus', 'bercahaya']","['bantu', 'atas', 'jerawat', 'jaga', 'kulit', 'halus', 'cahaya']"
jamu pelangsing(bobot idaman),"menurunkan berat badan sesuai dengan idaman, menahan bobot badan supaya tidak gemuk berlebihan, mengontrol kadar lemak bagian perut",ribkah maryam jokotole,Jamu Kesehatan,131,"menurunkan berat badan sesuai dengan idaman, menahan bobot badan supaya tidak gemuk berlebihan, mengontrol kadar lemak bagian perut",menurunkan berat badan sesuai dengan idaman menahan bobot badan supaya tidak gemuk berlebihan mengontrol kadar lemak bagian perut,"['menurunkan', 'berat', 'badan', 'sesuai', 'dengan', 'idaman', 'menahan', 'bobot', 'badan', 'supaya', 'tidak', 'gemuk', 'berlebihan', 'mengontrol', 'kadar', 'lemak', 'bagian', 'perut']","['menurunkan', 'berat', 'badan', 'sesuai', 'idaman', 'menahan', 'bobot', 'badan', 'gemuk', 'mengontrol', 'kadar', 'lemak', 'perut']","['turun', 'berat', 'badan', 'sesuai', 'idam', 'tahan', 'bobot', 'badan', 'gemuk', 'kontrol', 'kadar', 'lemak', 'perut']"
jamu pegel linu,"sangat berkhasiat menyembuhkan pegal - pegal linu otot - otot anda, menyembuhkan penyakit rematik / encok dan sakit pinggang",ribkah maryam jokotole,Jamu Kesehatan,124,"sangat berkhasiat menyembuhkan pegal - pegal linu otot - otot anda, menyembuhkan penyakit rematik / encok dan sakit pinggang",sangat berkhasiat menyembuhkan pegal  pegal linu otot  otot anda menyembuhkan penyakit rematik  encok dan sakit pinggang,"['sangat', 'berkhasiat', 'menyembuhkan', 'pegal', 'pegal', 'linu', 'otot', 'otot', 'anda', 'menyembuhkan', 'penyakit', 'rematik', 'encok', 'dan', 'sakit', 'pinggang']","['berkhasiat', 'menyembuhkan', 'pegal', 'pegal', 'linu', 'otot', 'otot', 'menyembuhkan', 'penyakit', 'rematik', 'encok', 'sakit', 'pinggang']","['khasiat', 'sembuh', 'pegal', 'pegal', 'linu', 'otot', 'otot', 'sembuh', 'sakit', 'rematik', 'encok', 'sakit', 'pinggang']"
jamu nifas (pluntur),"sangat efektif untuk wanita yang sering terlambat bulan, datang bulan tidak teratur, sakit-sakit badan waktu datang bulan",ribkah maryam jokotole,Jamu Perawatan Kewanitaan,121,"sangat efektif untuk wanita yang sering terlambat bulan, datang bulan tidak teratur, sakit-sakit badan waktu datang bulan",sangat efektif untuk wanita yang sering terlambat bulan datang bulan tidak teratur sakitsakit badan waktu datang bulan,"['sangat', 'efektif', 'untuk', 'wanita', 'yang', 'sering', 'terlambat', 'bulan', 'datang', 'bulan', 'tidak', 'teratur', 'sakitsakit', 'badan', 'waktu', 'datang', 'bulan']","['efektif', 'wanita', 'terlambat', 'teratur', 'sakitsakit', 'badan']","['efektif', 'wanita', 'lambat', 'atur', 'sakitsakit', 'badan']"
sehat lelaki (perkasa lelaki),Memperkuat fungsi lelaki serta meningkatkan ketahanan kejantanan,ribkah maryam jokotole,Jamu Pasutri,64,memperkuat fungsi lelaki serta meningkatkan ketahanan kejantanan,memperkuat fungsi lelaki serta meningkatkan ketahanan kejantanan,"['memperkuat', 'fungsi', 'lelaki', 'serta', 'meningkatkan', 'ketahanan', 'kejantanan']","['memperkuat', 'fungsi', 'lelaki', 'meningkatkan', 'ketahanan', 'kejantanan']","['kuat', 'fungsi', 'lelaki', 'tingkat', 'tahan', 'jantan']"
sepet madura(empot-empotan,"membuat denyut - denyut istimewa yang khas, memperkuat otot - otot kewanitaan, menghilangkan bau tidak enak gatal - gatal dan keputihan",ribkah maryam jokotole,Jamu Perawatan Kewanitaan,135,"membuat denyut - denyut istimewa yang khas, memperkuat otot - otot kewanitaan, menghilangkan bau tidak enak gatal - gatal dan keputihan",membuat denyut  denyut istimewa yang khas memperkuat otot  otot kewanitaan menghilangkan bau tidak enak gatal  gatal dan keputihan,"['membuat', 'denyut', 'denyut', 'istimewa', 'yang', 'khas', 'memperkuat', 'otot', 'otot', 'kewanitaan', 'menghilangkan', 'bau', 'tidak', 'enak', 'gatal', 'gatal', 'dan', 'keputihan']","['denyut', 'denyut', 'istimewa', 'khas', 'memperkuat', 'otot', 'otot', 'kewanitaan', 'menghilangkan', 'bau', 'enak', 'gatal', 'gatal', 'keputihan']","['denyut', 'denyut', 'istimewa', 'khas', 'kuat', 'otot', 'otot', 'wanita', 'hilang', 'bau', 'enak', 'gatal', 'gatal', 'putih']"
sehat perempuan(montok payudaya),"mengencangkan payudara, memperbesar payudara yang kurang ideal, menyehatkan dan memperindah payudara",ribkah maryam jokotole,Jamu Perawatan Kewanitaan,100,"mengencangkan payudara, memperbesar payudara yang kurang ideal, menyehatkan dan memperindah payudara",mengencangkan payudara memperbesar payudara yang kurang ideal menyehatkan dan memperindah payudara,"['mengencangkan', 'payudara', 'memperbesar', 'payudara', 'yang', 'kurang', 'ideal', 'menyehatkan', 'dan', 'memperindah', 'payudara']","['mengencangkan', 'payudara', 'memperbesar', 'payudara', 'ideal', 'menyehatkan', 'memperindah', 'payudara']","['encang', 'payudara', 'besar', 'payudara', 'ideal', 'sehat', 'indah', 'payudara']"
sari harum(keputihan),"sangat mujarab dan benar - benar ampuh untuk segala macam keputihan yang lama maupun yang baru. Menghilangkan bau yang tidak enak, gatal - gatal ",ribkah maryam jokotole,Jamu Perawatan Kewanitaan,145,"sangat mujarab dan benar - benar ampuh untuk segala macam keputihan yang lama maupun yang baru. menghilangkan bau yang tidak enak, gatal - gatal ",sangat mujarab dan benar  benar ampuh untuk segala macam keputihan yang lama maupun yang baru menghilangkan bau yang tidak enak gatal  gatal ,"['sangat', 'mujarab', 'dan', 'benar', 'benar', 'ampuh', 'untuk', 'segala', 'macam', 'keputihan', 'yang', 'lama', 'maupun', 'yang', 'baru', 'menghilangkan', 'bau', 'yang', 'tidak', 'enak', 'gatal', 'gatal']","['mujarab', 'ampuh', 'keputihan', 'menghilangkan', 'bau', 'enak', 'gatal', 'gatal']","['mujarab', 'ampuh', 'putih', 'hilang', 'bau', 'enak', 'gatal', 'gatal']"
awet ayu,"membuat dan menjaga kulit tubuh perempuan segar halus dan bercahaya, mengencangkan seluruh otot - otot tubuh anda agar tetap singset. Menjaga tubuh tetap sehat dan segar selalu",ribkah maryam jokotole,Jamu Perawatan Kewanitaan,176,"membuat dan menjaga kulit tubuh perempuan segar halus dan bercahaya, mengencangkan seluruh otot - otot tubuh anda agar tetap singset. menjaga tubuh tetap sehat dan segar selalu",membuat dan menjaga kulit tubuh perempuan segar halus dan bercahaya mengencangkan seluruh otot  otot tubuh anda agar tetap singset menjaga tubuh tetap sehat dan segar selalu,"['membuat', 'dan', 'menjaga', 'kulit', 'tubuh', 'perempuan', 'segar', 'halus', 'dan', 'bercahaya', 'mengencangkan', 'seluruh', 'otot', 'otot', 'tubuh', 'anda', 'agar', 'tetap', 'singset', 'menjaga', 'tubuh', 'tetap', 'sehat', 'dan', 'segar', 'selalu']","['menjaga', 'kulit', 'tubuh', 'perempuan', 'segar', 'halus', 'bercahaya', 'mengencangkan', 'otot', 'otot', 'tubuh', 'singset', 'menjaga', 'tubuh', 'sehat', 'segar']","['jaga', 'kulit', 'tubuh', 'perempuan', 'segar', 'halus', 'cahaya', 'encang', 'otot', 'otot', 'tubuh', 'singset', 'jaga', 'tubuh', 'sehat', 'segar']"
SUPER SEHAT BURUNG WALET,"Insya Allah sangat ampuh untuk mencegah dan menyembuhkan Rematik, Asam urat, Tekanan darah tinggi, Asma, Maag, Ginjal, Tipes, Cacingan, Sakit gigi, Lemah syahwat, Gatal - gatal alergi, Paru-paru basah, Kurang nafsu makan, Melancarkan Sirkulasi darah, Jerawat, Bisul, Kudis, Panu, Merawat Ms V, Mengatasi keputihan, Merawat dan mengencangkan kulit, Mencegah dan mengatasi penyakit menahun, Kelumpuhan / badan mati separuh seperti Stroke, Kanker, Liver, Kencing manis basah / kencing manis kering, Menjaga dan menambah daya tahan tubuh.",PT.QOMAR JAYA NUSANTARA,Jamu Kesehatan,534,"insya allah sangat ampuh untuk mencegah dan menyembuhkan rematik, asam urat, tekanan darah tinggi, asma, maag, ginjal, tipes, cacingan, sakit gigi, lemah syahwat, gatal - gatal alergi, paru-paru basah, kurang nafsu makan, melancarkan sirkulasi darah, jerawat, bisul, kudis, panu, merawat ms v, mengatasi keputihan, merawat dan mengencangkan kulit, mencegah dan mengatasi penyakit menahun, kelumpuhan / badan mati separuh seperti stroke, kanker, liver, kencing manis basah / kencing manis kering, menjaga dan menambah daya tahan tubuh.",insya allah sangat ampuh untuk mencegah dan menyembuhkan rematik asam urat tekanan darah tinggi asma maag ginjal tipes cacingan sakit gigi lemah syahwat gatal  gatal alergi paruparu basah kurang nafsu makan melancarkan sirkulasi darah jerawat bisul kudis panu merawat ms v mengatasi keputihan merawat dan mengencangkan kulit mencegah dan mengatasi penyakit menahun kelumpuhan  badan mati separuh seperti stroke kanker liver kencing manis basah  kencing manis kering menjaga dan menambah daya tahan tubuh,"['insya', 'allah', 'sangat', 'ampuh', 'untuk', 'mencegah', 'dan', 'menyembuhkan', 'rematik', 'asam', 'urat', 'tekanan', 'darah', 'tinggi', 'asma', 'maag', 'ginjal', 'tipes', 'cacingan', 'sakit', 'gigi', 'lemah', 'syahwat', 'gatal', 'gatal', 'alergi', 'paruparu', 'basah', 'kurang', 'nafsu', 'makan', 'melancarkan', 'sirkulasi', 'darah', 'jerawat', 'bisul', 'kudis', 'panu', 'merawat', 'ms', 'v', 'mengatasi', 'keputihan', 'merawat', 'dan', 'mengencangkan', 'kulit', 'mencegah', 'dan', 'mengatasi', 'penyakit', 'menahun', 'kelumpuhan', 'badan', 'mati', 'separuh', 'seperti', 'stroke', 'kanker', 'liver', 'kencing', 'manis', 'basah', 'kencing', 'manis', 'kering', 'menjaga', 'dan', 'menambah', 'daya', 'tahan', 'tubuh']","['insya', 'allah', 'ampuh', 'mencegah', 'menyembuhkan', 'rematik', 'asam', 'urat', 'tekanan', 'darah', 'asma', 'maag', 'ginjal', 'tipes', 'cacingan', 'sakit', 'gigi', 'lemah', 'syahwat', 'gatal', 'gatal', 'alergi', 'paruparu', 'basah', 'nafsu', 'makan', 'melancarkan', 'sirkulasi', 'darah', 'jerawat', 'bisul', 'kudis', 'panu', 'merawat', 'ms', 'v', 'mengatasi', 'keputihan', 'merawat', 'mengencangkan', 'kulit', 'mencegah', 'mengatasi', 'penyakit', 'menahun', 'kelumpuhan', 'badan', 'mati', 'separuh', 'stroke', 'kanker', 'liver', 'kencing', 'manis', 'basah', 'kencing', 'manis', 'kering', 'menjaga', 'menambah', 'daya', 'tahan', 'tubuh']","['insya', 'allah', 'ampuh', 'cegah', 'sembuh', 'rematik', 'asam', 'urat', 'tekan', 'darah', 'asma', 'maag', 'ginjal', 'tipes', 'cacing', 'sakit', 'gigi', 'lemah', 'syahwat', 'gatal', 'gatal', 'alergi', 'paruparu', 'basah', 'nafsu', 'makan', 'lancar', 'sirkulasi', 'darah', 'jerawat', 'bisul', 'kudis', 'panu', 'rawat', 'ms', 'v', 'atas', 'putih', 'rawat', 'encang', 'kulit', 'cegah', 'atas', 'sakit', 'tahun', 'lumpuh', 'badan', 'mati', 'paruh', 'stroke', 'kanker', 'liver', 'kencing', 'manis', 'basah', 'kencing', 'manis', 'kering', 'jaga', 'tambah', 'daya', 'tahan', 'tubuh']"
